[
  {
    "aktoerID": "1167540097033",
    "orgnr": "810072512",
    "utenlandskPersonID": null,
    "institusjonsID": "NO:NAVT001",
    "rolleKode": "BRUKER",
    "representererKode": "BRUKER"
  },
  {
    "aktoerID": "1167540098033",
    "orgnr": "810072512",
    "utenlandskPersonID": null,
    "institusjonsID": "NO:NAVT002",
    "rolleKode": "ARBEIDSGIVER",
    "representererKode": "BRUKER"
  },
  {
    "aktoerID": "1167540099033",
    "orgnr": "810072512",
    "utenlandskPersonID": null,
    "institusjonsID": "NO:NAVT002",
    "rolleKode": "REPRESENTANT",
    "representererKode": "BRUKER"
  },
  {
    "aktoerID": "1167540100033",
    "orgnr": "810072512",
    "utenlandskPersonID": null,
    "institusjonsID": "FR:RG75V00002",
    "rolleKode": "MYNDIGHET",
    "representererKode": "BRUKER"
  }
]
